{
  "manifest_version": 1,
  "dataset_id": "fixture-smoke-test",
  "media_type": "video",
  "created_at": "2026-05-21T00:00:00Z",
  "source_provider": "local_folder",
  "manifest_adapter": "ai-toolkit-ltx",
  "items": [
    {
      "item_id": "fixture_vid-s01",
      "source_type": "local_folder",
      "source_id": "fixture_source_001",
      "source_url": "file://fixtures/media/test_clip_01.mp4",
      "content_hash": "0000000000000000000000000000000000000000000000000000000000000001",
      "acquired_at": "2026-05-21T00:00:00Z",
      "media_type": "video",
      "media_path": "fixtures/media/test_clip_01.mp4",
      "duration_s": 5.0,
      "clip_start_s": 0.0,
      "clip_end_s": 5.0,
      "scene_index": 0,
      "bucket": "smoke_bucket",
      "caption": {
        "text": "A test clip for fixture validation.",
        "schema_version": 1,
        "confidence": 0.95
      },
      "caption_file": "fixtures/captions/fixture_vid-s01.caption.json",
      "filter_results": {
        "duration_filter": {"passed": true, "reason": ""},
        "resolution_filter": {"passed": true, "reason": ""},
        "content_hash_filter": {"passed": true, "reason": ""}
      },
      "review_status": "accepted",
      "review_decision": {
        "item_id": "fixture_vid-s01",
        "decision": "accept",
        "reject_reason": null,
        "edited_caption": null,
        "reviewed_at": "2026-05-21T00:00:00Z",
        "state_version": 3
      }
    },
    {
      "item_id": "fixture_vid-s03",
      "source_type": "local_folder",
      "source_id": "fixture_source_001",
      "source_url": "file://fixtures/media/test_clip_03.mp4",
      "content_hash": "0000000000000000000000000000000000000000000000000000000000000003",
      "acquired_at": "2026-05-21T00:00:00Z",
      "media_type": "video",
      "media_path": "fixtures/media/test_clip_03.mp4",
      "duration_s": 7.5,
      "clip_start_s": 0.0,
      "clip_end_s": 7.5,
      "scene_index": 2,
      "bucket": "smoke_bucket",
      "caption": {
        "text": "User-edited caption for testing.",
        "schema_version": 1,
        "confidence": 0.90
      },
      "caption_file": "fixtures/captions/fixture_vid-s03.caption.json",
      "filter_results": {
        "duration_filter": {"passed": true, "reason": ""},
        "resolution_filter": {"passed": true, "reason": ""},
        "content_hash_filter": {"passed": true, "reason": ""}
      },
      "review_status": "accepted",
      "review_decision": {
        "item_id": "fixture_vid-s03",
        "decision": "accept",
        "reject_reason": null,
        "edited_caption": "User-edited caption for testing.",
        "reviewed_at": "2026-05-21T00:02:00Z",
        "state_version": 4
      }
    }
  ],
  "stats": {
    "total_accepted": 2,
    "total_rejected": 1,
    "total_pending": 0,
    "total_sources": 1,
    "buckets": {
      "smoke_bucket": {
        "accepted": 2,
        "target": 2,
        "shortfall": 0
      }
    },
    "filter_pass_rates": {},
    "total_duration_s": 12.5,
    "estimated_cost_usd": 0.0
  }
}
